{
  "kind": "cineweave_codex_capability_profile",
  "contractVersion": "1.1.0",
  "profileId": "capability.reference-image-composite",
  "title": "Reference-image composite adapter capability profile",
  "version": 1,
  "status": "active",
  "adapterId": "adapter.reference-image-composite",
  "adapterClass": "composite",
  "skillReceipt": {
    "repository": "https://github.com/owner/repository",
    "ref": "v1.1.0",
    "commit": "0123456789abcdef0123456789abcdef01234567",
    "contentHash": "sha256:aaaaaaaaaaaaaaaaaaaaaaaaaaaaaaaaaaaaaaaaaaaaaaaaaaaaaaaaaaaaaaaa",
    "installedBy": "codex-environment",
    "usedAt": "2026-08-20T18:00:00.000Z"
  },
  "capabilities": [
    {
      "capabilityId": "image_generation",
      "support": "strong",
      "maxInputs": 8,
      "maxSubjects": 3,
      "supportedScopes": [
        "character",
        "scene"
      ],
      "constraints": [
        "Provider execution remains outside the Skill."
      ]
    },
    {
      "capabilityId": "multi_reference",
      "support": "strong",
      "maxInputs": 8,
      "maxSubjects": 3,
      "supportedScopes": [
        "face",
        "body",
        "costume",
        "pose",
        "scene_geography"
      ],
      "constraints": [
        "Every reference requires one semantic role."
      ]
    },
    {
      "capabilityId": "face_identity",
      "support": "strong",
      "maxInputs": 3,
      "maxSubjects": 2,
      "supportedScopes": [
        "face"
      ],
      "constraints": [
        "Extreme profiles require multiple views and human review."
      ]
    },
    {
      "capabilityId": "full_body_identity",
      "support": "partial",
      "maxInputs": 4,
      "maxSubjects": 1,
      "supportedScopes": [
        "body",
        "full_character"
      ],
      "constraints": [
        "Body proportion requires full-body evidence and pose guidance."
      ]
    },
    {
      "capabilityId": "expression_control",
      "support": "partial",
      "maxInputs": 2,
      "maxSubjects": 1,
      "supportedScopes": [
        "expression"
      ],
      "constraints": [
        "Emotion must be translated into observable cues."
      ]
    },
    {
      "capabilityId": "pose_guidance",
      "support": "strong",
      "maxInputs": 2,
      "maxSubjects": 3,
      "supportedScopes": [
        "pose"
      ],
      "constraints": [
        "Hand-object contact remains review-gated."
      ]
    },
    {
      "capabilityId": "scene_layout",
      "support": "partial",
      "maxInputs": 4,
      "maxSubjects": 4,
      "supportedScopes": [
        "geography",
        "composition"
      ],
      "constraints": [
        "Complex multi-object interactions may require regional repair."
      ]
    },
    {
      "capabilityId": "relighting",
      "support": "partial",
      "maxInputs": 2,
      "maxSubjects": 2,
      "supportedScopes": [
        "lighting"
      ],
      "constraints": [
        "Motivated source direction must be supplied."
      ]
    }
  ],
  "evidenceRequirements": [
    {
      "capabilityId": "face_identity",
      "requiredRoles": [
        "face_identity"
      ],
      "minimumConfidence": 0.8
    },
    {
      "capabilityId": "full_body_identity",
      "requiredRoles": [
        "body_identity"
      ],
      "minimumConfidence": 0.75
    },
    {
      "capabilityId": "pose_guidance",
      "requiredRoles": [
        "pose"
      ],
      "minimumConfidence": 0.7
    },
    {
      "capabilityId": "scene_layout",
      "requiredRoles": [
        "scene_geography"
      ],
      "minimumConfidence": 0.75
    }
  ],
  "knownLimits": [
    "Extreme perspective can distort body rhythm.",
    "Complex layered garments may require local repair.",
    "Precise hand-object contact is not guaranteed in one pass."
  ],
  "licenseProfileRefs": [
    {
      "id": "license.original-character-assets",
      "version": 1,
      "contentHash": "sha256:dddddddddddddddddddddddddddddddddddddddddddddddddddddddddddddddd"
    }
  ],
  "matchingPolicy": {
    "hardRequirementPolicy": "block",
    "partialSupportPolicy": "allow_with_review",
    "unknownCapabilityPolicy": "block"
  },
  "validation": {
    "noEndpoint": true,
    "noCredentials": true,
    "capabilityIdsUnique": true,
    "licensesLinked": true
  },
  "provenance": {
    "source": "codex_authored",
    "createdAt": "2026-08-20T18:00:00.000Z",
    "updatedAt": "2026-08-20T18:00:00.000Z",
    "changeLog": [
      "v1: declare provider-neutral composite adapter capabilities"
    ]
  }
}
